<?xml version="1.0" encoding="UTF-8"?>
<thing:thing-descriptions bindingId="yahooweather"
        xmlns:xsi="http://www.w3.org/2001/XMLSchema-instance"
        xmlns:thing="http://eclipse.org/smarthome/schemas/thing-description/v1.0.0"
        xsi:schemaLocation="http://eclipse.org/smarthome/schemas/thing-description/v1.0.0 http://eclipse.org/smarthome/schemas/thing-description-1.0.0.xsd">

    <!-- YahooWeather Binding -->
    <thing-type id="weather">
        <label>Weather Information *</label>
        <description>@text/CUSTOM_KEY</description>

		<channels>
			<channel id="temperature" typeId="temperature" />
		</channels>

    </thing-type>

    <channel-type id="temperature">
        <item-type>Number</item-type>
        <label>Temperature</label>
        <description>Current temperature in degrees celsius (metric) or fahrenheit (us)</description>
    </channel-type>

</thing:thing-descriptions>
