<?xml version="1.0" encoding="UTF-8"?>
<thing:thing-descriptions bindingId="hue"
    xmlns:xsi="http://www.w3.org/2001/XMLSchema-instance"
    xmlns:thing="http://eclipse.org/smarthome/schemas/thing-description/v1.0.0"
    xsi:schemaLocation="http://eclipse.org/smarthome/schemas/thing-description/v1.0.0 http://eclipse.org/smarthome/schemas/thing-description-1.0.0.xsd">

    <!-- Color Channel -->
    <channel-type id="color">
        <item-type>Color</item-type>
        <label>Color</label>
        <description>The color channel allows to control the color of a light.
            It is also possible to dim values and switch the light on and off.
        </description>
        <tags>
            <tag>Hue</tag>
            <tag>ColorLamp</tag>
        </tags>

        <config-description>
            <parameter name="lastDimValue" type="boolean" />
        </config-description>
    </channel-type>

    <!-- Brightness Channel -->
    <channel-type id="brightness">
        <item-type>Dimmer</item-type>
        <label>Brightness</label>
        <description>The brightness channel allows to control the brightness of a light.
            It is also possible to switch the light on and off.
        </description>
        <tags>
            <tag>Hue</tag>
            <tag>DimmableLamp</tag>
        </tags>

        <config-description>
            <parameter name="lastDimValue" type="boolean" />
        </config-description>
    </channel-type>

    <!-- Color Temperature Channel -->
    <channel-type id="color_temperature">
        <item-type>Dimmer</item-type>
        <label>Color Temperature</label>
        <description>The color temperature channel allows to set the color
            temperature of a light from 0 (cold) to 100 (warm).</description>
        <tags>
            <tag>Hue</tag>
            <tag>AmbientLamp</tag>
        </tags>
    </channel-type>

    <!-- Alarm Channel -->
    <channel-type id="alarm">
        <item-type>Number</item-type>
        <label>Alarm System</label>
        <description>The light blinks if alarm is set.</description>
        <category>ALARM</category>
        <tags>
            <tag>Hue</tag>
            <tag>AlarmSystem</tag>
        </tags>
        <state-description>
            <range min="0" max="100.0" />
            <step size="10.0" />
            <format pattern="%d Celsius" />
            <states>
                <state value="LIGHT" label="Light" />
                <state value="SOUND" label="Sound" />
            </states>
        </state-description>
    </channel-type>

    <!-- Motion Channel -->
    <channel-type id="motion" readOnly="true">
        <item-type>Number</item-type>
        <label>Motion Sensor</label>
        <description>The sensor detecting motion.</description>
        <category>MOTION</category>
        <tags>
            <tag>Hue</tag>
            <tag>AlarmSystem</tag>
        </tags>
    </channel-type>

    <!-- Alarm System Channel -->
    <channel-group-type id="alarm_system">
        <item-type>Number</item-type>
        <label>Alarm System</label>
        <description>The alarm system.</description>
        <tags>
            <tag>Hue</tag>
            <tag>AlarmSystem</tag>
        </tags>
        <channels>
            <channel id="alarm" typeId="alarm"/>
            <channel id="motion" typeId="motion"/>
        </channels>
    </channel-group-type>

</thing:thing-descriptions>
